Top queries,Clicks,Impressions,CTR,Position
cleaning services sanford fl,0,14,0%,62.5
move out house cleaning services near me,0,10,0%,95.2
deep cleaning near me,0,5,0%,41.8
home cleaners near me,0,4,0%,18.5
housekeeping services near me,0,4,0%,18.75
dust removal after construction altamonte springs,0,4,0%,41.75
deep cleaning,0,4,0%,51
carpet cleaning sanford fl,0,4,0%,72
new build cleaning altamonte springs,0,3,0%,48.67
rug cleaning sanford,0,3,0%,52.33
after construction cleaning,0,3,0%,83.67
cleaning services sanford,0,2,0%,66
house cleaning sanford fl,0,1,0%,12
bathroom cleaning service near me,0,1,0%,16
house cleaners near me,0,1,0%,18
professional cleaning services near me,0,1,0%,24
sanford house cleaning,0,1,0%,27
home cleaning services,0,1,0%,32
post-renovation cleaning altamonte springs fl,0,1,0%,37
post construction cleaning florida,0,1,0%,38
house cleaning services sanford,0,1,0%,44
carpet cleaning sanford,0,1,0%,50
sanford cleaning service,0,1,0%,62
sanford pressure washing,0,1,0%,92
move in cleaning service near me,0,1,0%,95